{
  "$comment": "Installer UI metadata, one entry per package key (packages/<key>, features/<key>). Ids, versions, files and package dependencies come from tools/build/layout.py; setupkit merges both into components.json. A package without an entry still ships, unticked, in fallbackCategory (a --strict build fails instead). Entries with kind \"dependency\" are third-party runtime mods the manager downloads from their authors (pinned sha256 and licence); setupkit passes them through, and requiredBy follows the code (tools/build/setupkit/manifest/tests/test_dependencies.py).",
  "fallbackCategory": "other",
  "fallbackFairPlay": {
    "ru": "Работает только с вашими данными и не показывает информацию о противниках.",
    "en": "Uses only your own data and shows nothing about enemies."
  },
  "ownedPatterns": ["net.triotmetki.*.mtmod", "net.triotmetki.*.wotmod", "otmetki.*.mtmod", "otmetki.*.wotmod"],
  "ownedPaths": [
    "scripts/client/gui/mods/otmetki/",
    "scripts/client/gui/mods/mod_otmetki",
    "gui/gameface/mods/triotmetki/",
    "gui/maps/icons/otmetki/",
    "mods/configs/res_map/net.triotmetki."
  ],
  "conflicts": [
    {
      "id": "xvm",
      "title": {
        "ru": "XVM",
        "en": "XVM"
      },
      "patterns": ["com.modxvm.*", "*xvm*"],
      "components": ["damage_log", "sixth_sense", "minimap"],
      "note": {
        "ru": "Свой лог урона, лог попаданий, лампа и мини-карта: при включённых наших панелях выйдут две одинаковые.",
        "en": "Its own damage log, hit log, lamp and minimap: with our panels on you get two of each."
      }
    },
    {
      "id": "pmod",
      "title": {
        "ru": "PMOD",
        "en": "PMOD"
      },
      "patterns": ["*pmod*"],
      "components": ["damage_log", "team_hp", "camera", "crosshair"],
      "note": {
        "ru": "Лог урона, ХП команд и настройки камеры и прицела пересекаются с нашими.",
        "en": "Its damage log, team HP and camera and crosshair settings overlap ours."
      }
    },
    {
      "id": "battle_observer",
      "title": {
        "ru": "Battle Observer",
        "en": "Battle Observer"
      },
      "patterns": ["*battleobserver*", "*battle_observer*", "armagomen.*"],
      "components": ["team_hp", "damage_log", "battle_progress", "hangar_info", "sixth_sense", "session_stats"],
      "note": {
        "ru": "ХП команд, лог урона, «Основной калибр», часы и сессия: две версии одних панелей, известны падения клиента.",
        "en": "Team HP, damage log, High Caliber, clock and session: two copies of the same panels; client crashes are known."
      }
    },
    {
      "id": "marks_calculator",
      "title": {
        "ru": "Калькулятор отметок",
        "en": "Marks calculator"
      },
      "patterns": ["*marksongun*", "*marks_on_gun*", "*marksonguns*", "*gunmarks*", "*markofexcellence*"],
      "components": ["marks_panel"],
      "note": {
        "ru": "Второй калькулятор отметок: две панели с процентом в бою и в ангаре.",
        "en": "A second marks calculator: two MoE panels in battle and in the hangar."
      }
    },
    {
      "id": "sixth_sense_lamp",
      "title": {
        "ru": "Лампа шестого чувства",
        "en": "Sixth sense lamp"
      },
      "patterns": ["*sixthsense*", "*sixth_sense*", "*6thsense*", "*6th_sense*"],
      "components": ["sixth_sense"],
      "note": {
        "ru": "Вторая лампа: два значка и два звука засвета.",
        "en": "A second lamp: two icons and two spotted sounds."
      }
    },
    {
      "id": "damage_log_mod",
      "title": {
        "ru": "Лог урона",
        "en": "Damage log"
      },
      "patterns": ["*damagelog*", "*damage_log*", "*hitlog*", "*hit_log*"],
      "components": ["damage_log"],
      "note": {
        "ru": "Второй лог урона или попаданий.",
        "en": "A second damage or hit log."
      }
    },
    {
      "id": "session_stats_mod",
      "title": {
        "ru": "Статистика сессии",
        "en": "Session stats"
      },
      "patterns": ["*sessionstat*", "*session_stat*"],
      "components": ["session_stats"],
      "note": {
        "ru": "Вторая статистика сессии; такие моды у Armagomen и Левши роняли клиент вместе с другими.",
        "en": "A second session stats mod; the Armagomen and Levsha ones crashed the client together with others."
      }
    },
    {
      "id": "replays_manager_mod",
      "title": {
        "ru": "Менеджер реплеев",
        "en": "Replays manager"
      },
      "patterns": ["*replaysmanager*", "*replays_manager*", "*replaymanager*"],
      "components": ["replay_manager"],
      "note": {
        "ru": "Второй менеджер реплеев в ангаре.",
        "en": "A second replays manager in the hangar."
      }
    }
  ],
  "presets": [
    {
      "id": "recommended",
      "title": {
        "ru": "Рекомендуемый",
        "en": "Recommended"
      },
      "description": {
        "ru": "Основные панели боя и ангара — то, чем пользуется большинство игроков.",
        "en": "The main battle and hangar panels: what most players use."
      }
    },
    {
      "id": "minimal",
      "title": {
        "ru": "Минимальный (FPS)",
        "en": "Minimal (FPS)"
      },
      "description": {
        "ru": "Только отметка в бою, лампа и чистый ангар: минимум нагрузки на слабых ПК.",
        "en": "Only the in-battle MoE panel, the sixth sense lamp and the clean hangar: the lightest load for weak PCs."
      }
    },
    {
      "id": "streamer",
      "title": {
        "ru": "Стример",
        "en": "Streamer"
      },
      "description": {
        "ru": "Панели, которые интересно видеть зрителям: отметка, урон, перезарядка и оборудование, плюс режим стримера с клавишей «убрать панели».",
        "en": "Panels viewers like to see: MoE, damage, reload and equipment, plus the streamer mode with its “hide panels” key."
      }
    },
    {
      "id": "custom",
      "custom": true,
      "title": {
        "ru": "Свой",
        "en": "Custom"
      },
      "description": {
        "ru": "Отметьте компоненты сами.",
        "en": "Pick the components yourself."
      }
    }
  ],
  "categories": [
    {
      "id": "base",
      "title": {
        "ru": "Основа",
        "en": "Core"
      },
      "description": {
        "ru": "Ядро и компаньон «Три отметки»: нужны всем остальным компонентам и связывают мод с сайтом.",
        "en": "The Three Marks core and companion: every other component needs them, and they link the mod to the site."
      }
    },
    {
      "id": "battle",
      "title": {
        "ru": "В бою",
        "en": "In battle"
      },
      "description": {
        "ru": "Панели боевого интерфейса.",
        "en": "Battle interface panels."
      }
    },
    {
      "id": "hangar",
      "title": {
        "ru": "Ангар",
        "en": "Hangar"
      },
      "description": {
        "ru": "Статистика, итоги боёв и удобства ангара.",
        "en": "Stats, battle results and hangar conveniences."
      }
    },
    {
      "id": "data",
      "title": {
        "ru": "Сайт и данные",
        "en": "Site and data"
      },
      "description": {
        "ru": "Что мод может отправлять на triotmetki.ru после привязки.",
        "en": "What the mod can send to triotmetki.ru once bound."
      }
    },
    {
      "id": "other",
      "title": {
        "ru": "Другое",
        "en": "Other"
      },
      "description": {
        "ru": "Компоненты без описания в каталоге установщика.",
        "en": "Components the installer catalog does not describe yet."
      }
    }
  ],
  "components": [
    {
      "id": "core",
      "category": "base",
      "context": "any",
      "required": true,
      "title": {
        "ru": "Ядро",
        "en": "Core runtime"
      },
      "description": {
        "ru": "Общая основа всех модулей: события, настройки, журнал. Сам по себе ничего не показывает.",
        "en": "The shared runtime of every module: events, settings, log. Shows nothing by itself."
      },
      "fairPlay": {
        "ru": "Не читает данные боя.",
        "en": "Reads no battle data."
      },
      "perf": "low",
      "preview": {
        "image": "previews/base.svg"
      }
    },
    {
      "id": "companion",
      "category": "base",
      "context": "any",
      "required": true,
      "title": {
        "ru": "Компаньон «Три отметки»",
        "en": "Three Marks companion"
      },
      "description": {
        "ru": "Привязка к сайту, отправка ваших итогов боя и процентов отметок. Ничего не отправляет, пока вы не привяжете мод кодом с сайта.",
        "en": "Links the mod to the site and sends your own battle results and MoE percentages. Sends nothing until you bind it with a code from the site."
      },
      "fairPlay": {
        "ru": "Только ваши данные: ваша часть итогов боя и ваше досье. Данные других игроков не читаются.",
        "en": "Only your own data: your part of the battle results and your dossier. Other players' data is never read."
      },
      "perf": "low",
      "preview": {
        "image": "previews/base.svg"
      }
    },
    {
      "id": "ui",
      "category": "base",
      "context": "hangar",
      "required": true,
      "title": {
        "ru": "Интерфейс в игре",
        "en": "In-game UI"
      },
      "description": {
        "ru": "Окно настроек и панели «Три отметки» в игре.",
        "en": "The Three Marks settings window and panels in the game."
      },
      "fairPlay": {
        "ru": "Показывает только то, что передают другие компоненты.",
        "en": "Shows only what the other components provide."
      },
      "perf": "low",
      "preview": {
        "image": "previews/base.svg"
      }
    },
    {
      "id": "marks_panel",
      "category": "battle",
      "context": "any",
      "presets": ["recommended", "minimal", "streamer"],
      "title": {
        "ru": "Отметки",
        "en": "Marks of Excellence"
      },
      "description": {